No.     Time           Source                Destination           Protocol Length Info
    307 3.707271000    192.168.0.51          104.155.6.9           WebSocket 78     WebSocket Text [FIN] [MASKED]

Frame 307: 78 bytes on wire (624 bits), 78 bytes captured (624 bits) on interface 0
    Interface id: 0 (enp12s0)
    Encapsulation type: Ethernet (1)
    Arrival Time: Dec 22, 2014 15:32:23.020871000 CET
    [Time shift for this packet: 0.000000000 seconds]
    Epoch Time: 1419258743.020871000 seconds
    [Time delta from previous captured frame: 0.010851000 seconds]
    [Time delta from previous displayed frame: 0.000000000 seconds]
    [Time since reference or first frame: 3.707271000 seconds]
    Frame Number: 307
    Frame Length: 78 bytes (624 bits)
    Capture Length: 78 bytes (624 bits)
    [Frame is marked: False]
    [Frame is ignored: False]
    [Protocols in frame: eth:ethertype:ip:tcp:http:websocket]
    [Coloring Rule Name: TCP]
    [Coloring Rule String: tcp]
Ethernet II, Src: d4:be:d9:74:bf:b6 (d4:be:d9:74:bf:b6), Dst: 64:66:b3:9e:39:08 (64:66:b3:9e:39:08)
    Destination: 64:66:b3:9e:39:08 (64:66:b3:9e:39:08)
        Address: 64:66:b3:9e:39:08 (64:66:b3:9e:39:08)
        .... ..0. .... .... .... .... = LG bit: Globally unique address (factory default)
        .... ...0 .... .... .... .... = IG bit: Individual address (unicast)
    Source: d4:be:d9:74:bf:b6 (d4:be:d9:74:bf:b6)
        Address: d4:be:d9:74:bf:b6 (d4:be:d9:74:bf:b6)
        .... ..0. .... .... .... .... = LG bit: Globally unique address (factory default)
        .... ...0 .... .... .... .... = IG bit: Individual address (unicast)
    Type: IP (0x0800)
Internet Protocol Version 4, Src: 192.168.0.51 (192.168.0.51), Dst: 104.155.6.9 (104.155.6.9)
    Version: 4
    Header Length: 20 bytes
    Differentiated Services Field: 0x00 (DSCP 0x00: Default; ECN: 0x00: Not-ECT (Not ECN-Capable Transport))
        0000 00.. = Differentiated Services Codepoint: Default (0x00)
        .... ..00 = Explicit Congestion Notification: Not-ECT (Not ECN-Capable Transport) (0x00)
    Total Length: 64
    Identification: 0x1fff (8191)
    Flags: 0x02 (Don't Fragment)
        0... .... = Reserved bit: Not set
        .1.. .... = Don't fragment: Set
        ..0. .... = More fragments: Not set
    Fragment offset: 0
    Time to live: 64
    Protocol: TCP (6)
    Header checksum: 0xeb39 [validation disabled]
        [Good: False]
        [Bad: False]
    Source: 192.168.0.51 (192.168.0.51)
    Destination: 104.155.6.9 (104.155.6.9)
    [Source GeoIP: Unknown]
    [Destination GeoIP: Unknown]
Transmission Control Protocol, Src Port: 58512 (58512), Dst Port: 8002 (8002), Seq: 639, Ack: 130, Len: 12
    Source Port: 58512 (58512)
    Destination Port: 8002 (8002)
    [Stream index: 27]
    [TCP Segment Len: 12]
    Sequence number: 639    (relative sequence number)
    [Next sequence number: 651    (relative sequence number)]
    Acknowledgment number: 130    (relative ack number)
    Header Length: 32 bytes
    .... 0000 0001 1000 = Flags: 0x018 (PSH, ACK)
        000. .... .... = Reserved: Not set
        ...0 .... .... = Nonce: Not set
        .... 0... .... = Congestion Window Reduced (CWR): Not set
        .... .0.. .... = ECN-Echo: Not set
        .... ..0. .... = Urgent: Not set
        .... ...1 .... = Acknowledgment: Set
        .... .... 1... = Push: Set
        .... .... .0.. = Reset: Not set
        .... .... ..0. = Syn: Not set
        .... .... ...0 = Fin: Not set
    Window size value: 237
    [Calculated window size: 30336]
    [Window size scaling factor: 128]
    Checksum: 0x2fb2 [validation disabled]
        [Good Checksum: False]
        [Bad Checksum: False]
    Urgent pointer: 0
    Options: (12 bytes), No-Operation (NOP), No-Operation (NOP), Timestamps
        No-Operation (NOP)
            Type: 1
                0... .... = Copy on fragmentation: No
                .00. .... = Class: Control (0)
                ...0 0001 = Number: No-Operation (NOP) (1)
        No-Operation (NOP)
            Type: 1
                0... .... = Copy on fragmentation: No
                .00. .... = Class: Control (0)
                ...0 0001 = Number: No-Operation (NOP) (1)
        Timestamps: TSval 339301784, TSecr 155530543
            Kind: Time Stamp Option (8)
            Length: 10
            Timestamp value: 339301784
            Timestamp echo reply: 155530543
    [SEQ/ACK analysis]
        [iRTT: 0.035942000 seconds]
        [Bytes in flight: 12]
WebSocket
    1... .... = Fin: True
    .000 .... = Reserved: 0x00
    .... 0001 = Opcode: Text (1)
    1... .... = Mask: True
    .000 0110 = Payload length: 6
    Masking-Key: 920358b4
    Payload
        Text: a0732adbf066
    Unmask Payload
        [Text unmask: 2probe]

No.     Time           Source                Destination           Protocol Length Info
    315 3.743479000    104.155.6.9           192.168.0.51          WebSocket 74     WebSocket Text [FIN] 

Frame 315: 74 bytes on wire (592 bits), 74 bytes captured (592 bits) on interface 0
    Interface id: 0 (enp12s0)
    Encapsulation type: Ethernet (1)
    Arrival Time: Dec 22, 2014 15:32:23.057079000 CET
    [Time shift for this packet: 0.000000000 seconds]
    Epoch Time: 1419258743.057079000 seconds
    [Time delta from previous captured frame: 0.009928000 seconds]
    [Time delta from previous displayed frame: 0.036208000 seconds]
    [Time since reference or first frame: 3.743479000 seconds]
    Frame Number: 315
    Frame Length: 74 bytes (592 bits)
    Capture Length: 74 bytes (592 bits)
    [Frame is marked: False]
    [Frame is ignored: False]
    [Protocols in frame: eth:ethertype:ip:tcp:http:websocket]
    [Coloring Rule Name: TCP]
    [Coloring Rule String: tcp]
Ethernet II, Src: 64:66:b3:9e:39:08 (64:66:b3:9e:39:08), Dst: d4:be:d9:74:bf:b6 (d4:be:d9:74:bf:b6)
    Destination: d4:be:d9:74:bf:b6 (d4:be:d9:74:bf:b6)
        Address: d4:be:d9:74:bf:b6 (d4:be:d9:74:bf:b6)
        .... ..0. .... .... .... .... = LG bit: Globally unique address (factory default)
        .... ...0 .... .... .... .... = IG bit: Individual address (unicast)
    Source: 64:66:b3:9e:39:08 (64:66:b3:9e:39:08)
        Address: 64:66:b3:9e:39:08 (64:66:b3:9e:39:08)
        .... ..0. .... .... .... .... = LG bit: Globally unique address (factory default)
        .... ...0 .... .... .... .... = IG bit: Individual address (unicast)
    Type: IP (0x0800)
Internet Protocol Version 4, Src: 104.155.6.9 (104.155.6.9), Dst: 192.168.0.51 (192.168.0.51)
    Version: 4
    Header Length: 20 bytes
    Differentiated Services Field: 0x00 (DSCP 0x00: Default; ECN: 0x00: Not-ECT (Not ECN-Capable Transport))
        0000 00.. = Differentiated Services Codepoint: Default (0x00)
        .... ..00 = Explicit Congestion Notification: Not-ECT (Not ECN-Capable Transport) (0x00)
    Total Length: 60
    Identification: 0x455b (17755)
    Flags: 0x02 (Don't Fragment)
        0... .... = Reserved bit: Not set
        .1.. .... = Don't fragment: Set
        ..0. .... = More fragments: Not set
    Fragment offset: 0
    Time to live: 42
    Protocol: TCP (6)
    Header checksum: 0xdbe1 [validation disabled]
        [Good: False]
        [Bad: False]
    Source: 104.155.6.9 (104.155.6.9)
    Destination: 192.168.0.51 (192.168.0.51)
    [Source GeoIP: Unknown]
    [Destination GeoIP: Unknown]
Transmission Control Protocol, Src Port: 8002 (8002), Dst Port: 58512 (58512), Seq: 130, Ack: 651, Len: 8
    Source Port: 8002 (8002)
    Destination Port: 58512 (58512)
    [Stream index: 27]
    [TCP Segment Len: 8]
    Sequence number: 130    (relative sequence number)
    [Next sequence number: 138    (relative sequence number)]
    Acknowledgment number: 651    (relative ack number)
    Header Length: 32 bytes
    .... 0000 0001 1000 = Flags: 0x018 (PSH, ACK)
        000. .... .... = Reserved: Not set
        ...0 .... .... = Nonce: Not set
        .... 0... .... = Congestion Window Reduced (CWR): Not set
        .... .0.. .... = ECN-Echo: Not set
        .... ..0. .... = Urgent: Not set
        .... ...1 .... = Acknowledgment: Set
        .... .... 1... = Push: Set
        .... .... .0.. = Reset: Not set
        .... .... ..0. = Syn: Not set
        .... .... ...0 = Fin: Not set
    Window size value: 480
    [Calculated window size: 15360]
    [Window size scaling factor: 32]
    Checksum: 0x8c2f [validation disabled]
        [Good Checksum: False]
        [Bad Checksum: False]
    Urgent pointer: 0
    Options: (12 bytes), No-Operation (NOP), No-Operation (NOP), Timestamps
        No-Operation (NOP)
            Type: 1
                0... .... = Copy on fragmentation: No
                .00. .... = Class: Control (0)
                ...0 0001 = Number: No-Operation (NOP) (1)
        No-Operation (NOP)
            Type: 1
                0... .... = Copy on fragmentation: No
                .00. .... = Class: Control (0)
                ...0 0001 = Number: No-Operation (NOP) (1)
        Timestamps: TSval 155530555, TSecr 339301784
            Kind: Time Stamp Option (8)
            Length: 10
            Timestamp value: 155530555
            Timestamp echo reply: 339301784
    [SEQ/ACK analysis]
        [This is an ACK to the segment in frame: 307]
        [The RTT to ACK the segment was: 0.036208000 seconds]
        [iRTT: 0.035942000 seconds]
        [Bytes in flight: 8]
WebSocket
    1... .... = Fin: True
    .000 .... = Reserved: 0x00
    .... 0001 = Opcode: Text (1)
    0... .... = Mask: False
    .000 0110 = Payload length: 6
    Payload
        Text: 3probe

No.     Time           Source                Destination           Protocol Length Info
    353 3.866400000    192.168.0.51          104.155.6.9           WebSocket 73     WebSocket Text [FIN] [MASKED]

Frame 353: 73 bytes on wire (584 bits), 73 bytes captured (584 bits) on interface 0
    Interface id: 0 (enp12s0)
    Encapsulation type: Ethernet (1)
    Arrival Time: Dec 22, 2014 15:32:23.180000000 CET
    [Time shift for this packet: 0.000000000 seconds]
    Epoch Time: 1419258743.180000000 seconds
    [Time delta from previous captured frame: 0.001675000 seconds]
    [Time delta from previous displayed frame: 0.122921000 seconds]
    [Time since reference or first frame: 3.866400000 seconds]
    Frame Number: 353
    Frame Length: 73 bytes (584 bits)
    Capture Length: 73 bytes (584 bits)
    [Frame is marked: False]
    [Frame is ignored: False]
    [Protocols in frame: eth:ethertype:ip:tcp:http:websocket]
    [Coloring Rule Name: TCP]
    [Coloring Rule String: tcp]
Ethernet II, Src: d4:be:d9:74:bf:b6 (d4:be:d9:74:bf:b6), Dst: 64:66:b3:9e:39:08 (64:66:b3:9e:39:08)
    Destination: 64:66:b3:9e:39:08 (64:66:b3:9e:39:08)
        Address: 64:66:b3:9e:39:08 (64:66:b3:9e:39:08)
        .... ..0. .... .... .... .... = LG bit: Globally unique address (factory default)
        .... ...0 .... .... .... .... = IG bit: Individual address (unicast)
    Source: d4:be:d9:74:bf:b6 (d4:be:d9:74:bf:b6)
        Address: d4:be:d9:74:bf:b6 (d4:be:d9:74:bf:b6)
        .... ..0. .... .... .... .... = LG bit: Globally unique address (factory default)
        .... ...0 .... .... .... .... = IG bit: Individual address (unicast)
    Type: IP (0x0800)
Internet Protocol Version 4, Src: 192.168.0.51 (192.168.0.51), Dst: 104.155.6.9 (104.155.6.9)
    Version: 4
    Header Length: 20 bytes
    Differentiated Services Field: 0x00 (DSCP 0x00: Default; ECN: 0x00: Not-ECT (Not ECN-Capable Transport))
        0000 00.. = Differentiated Services Codepoint: Default (0x00)
        .... ..00 = Explicit Congestion Notification: Not-ECT (Not ECN-Capable Transport) (0x00)
    Total Length: 59
    Identification: 0x2001 (8193)
    Flags: 0x02 (Don't Fragment)
        0... .... = Reserved bit: Not set
        .1.. .... = Don't fragment: Set
        ..0. .... = More fragments: Not set
    Fragment offset: 0
    Time to live: 64
    Protocol: TCP (6)
    Header checksum: 0xeb3c [validation disabled]
        [Good: False]
        [Bad: False]
    Source: 192.168.0.51 (192.168.0.51)
    Destination: 104.155.6.9 (104.155.6.9)
    [Source GeoIP: Unknown]
    [Destination GeoIP: Unknown]
Transmission Control Protocol, Src Port: 58512 (58512), Dst Port: 8002 (8002), Seq: 651, Ack: 138, Len: 7
    Source Port: 58512 (58512)
    Destination Port: 8002 (8002)
    [Stream index: 27]
    [TCP Segment Len: 7]
    Sequence number: 651    (relative sequence number)
    [Next sequence number: 658    (relative sequence number)]
    Acknowledgment number: 138    (relative ack number)
    Header Length: 32 bytes
    .... 0000 0001 1000 = Flags: 0x018 (PSH, ACK)
        000. .... .... = Reserved: Not set
        ...0 .... .... = Nonce: Not set
        .... 0... .... = Congestion Window Reduced (CWR): Not set
        .... .0.. .... = ECN-Echo: Not set
        .... ..0. .... = Urgent: Not set
        .... ...1 .... = Acknowledgment: Set
        .... .... 1... = Push: Set
        .... .... .0.. = Reset: Not set
        .... .... ..0. = Syn: Not set
        .... .... ...0 = Fin: Not set
    Window size value: 237
    [Calculated window size: 30336]
    [Window size scaling factor: 128]
    Checksum: 0x2fad [validation disabled]
        [Good Checksum: False]
        [Bad Checksum: False]
    Urgent pointer: 0
    Options: (12 bytes), No-Operation (NOP), No-Operation (NOP), Timestamps
        No-Operation (NOP)
            Type: 1
                0... .... = Copy on fragmentation: No
                .00. .... = Class: Control (0)
                ...0 0001 = Number: No-Operation (NOP) (1)
        No-Operation (NOP)
            Type: 1
                0... .... = Copy on fragmentation: No
                .00. .... = Class: Control (0)
                ...0 0001 = Number: No-Operation (NOP) (1)
        Timestamps: TSval 339301832, TSecr 155530555
            Kind: Time Stamp Option (8)
            Length: 10
            Timestamp value: 339301832
            Timestamp echo reply: 155530555
    [SEQ/ACK analysis]
        [iRTT: 0.035942000 seconds]
        [Bytes in flight: 7]
WebSocket
    1... .... = Fin: True
    .000 .... = Reserved: 0x00
    .... 0001 = Opcode: Text (1)
    1... .... = Mask: True
    .000 0001 = Payload length: 1
    Masking-Key: a68230f8
    Payload
        Text: 93
    Unmask Payload
        [Text unmask: 5]

No.     Time           Source                Destination           Protocol Length Info
    354 3.867981000    192.168.0.51          104.155.6.9           WebSocket 121    WebSocket Text [FIN] [MASKED]

Frame 354: 121 bytes on wire (968 bits), 121 bytes captured (968 bits) on interface 0
    Interface id: 0 (enp12s0)
    Encapsulation type: Ethernet (1)
    Arrival Time: Dec 22, 2014 15:32:23.181581000 CET
    [Time shift for this packet: 0.000000000 seconds]
    Epoch Time: 1419258743.181581000 seconds
    [Time delta from previous captured frame: 0.001581000 seconds]
    [Time delta from previous displayed frame: 0.001581000 seconds]
    [Time since reference or first frame: 3.867981000 seconds]
    Frame Number: 354
    Frame Length: 121 bytes (968 bits)
    Capture Length: 121 bytes (968 bits)
    [Frame is marked: False]
    [Frame is ignored: False]
    [Protocols in frame: eth:ethertype:ip:tcp:http:websocket]
    [Coloring Rule Name: TCP]
    [Coloring Rule String: tcp]
Ethernet II, Src: d4:be:d9:74:bf:b6 (d4:be:d9:74:bf:b6), Dst: 64:66:b3:9e:39:08 (64:66:b3:9e:39:08)
    Destination: 64:66:b3:9e:39:08 (64:66:b3:9e:39:08)
        Address: 64:66:b3:9e:39:08 (64:66:b3:9e:39:08)
        .... ..0. .... .... .... .... = LG bit: Globally unique address (factory default)
        .... ...0 .... .... .... .... = IG bit: Individual address (unicast)
    Source: d4:be:d9:74:bf:b6 (d4:be:d9:74:bf:b6)
        Address: d4:be:d9:74:bf:b6 (d4:be:d9:74:bf:b6)
        .... ..0. .... .... .... .... = LG bit: Globally unique address (factory default)
        .... ...0 .... .... .... .... = IG bit: Individual address (unicast)
    Type: IP (0x0800)
Internet Protocol Version 4, Src: 192.168.0.51 (192.168.0.51), Dst: 104.155.6.9 (104.155.6.9)
    Version: 4
    Header Length: 20 bytes
    Differentiated Services Field: 0x00 (DSCP 0x00: Default; ECN: 0x00: Not-ECT (Not ECN-Capable Transport))
        0000 00.. = Differentiated Services Codepoint: Default (0x00)
        .... ..00 = Explicit Congestion Notification: Not-ECT (Not ECN-Capable Transport) (0x00)
    Total Length: 107
    Identification: 0x2002 (8194)
    Flags: 0x02 (Don't Fragment)
        0... .... = Reserved bit: Not set
        .1.. .... = Don't fragment: Set
        ..0. .... = More fragments: Not set
    Fragment offset: 0
    Time to live: 64
    Protocol: TCP (6)
    Header checksum: 0xeb0b [validation disabled]
        [Good: False]
        [Bad: False]
    Source: 192.168.0.51 (192.168.0.51)
    Destination: 104.155.6.9 (104.155.6.9)
    [Source GeoIP: Unknown]
    [Destination GeoIP: Unknown]
Transmission Control Protocol, Src Port: 58512 (58512), Dst Port: 8002 (8002), Seq: 658, Ack: 138, Len: 55
    Source Port: 58512 (58512)
    Destination Port: 8002 (8002)
    [Stream index: 27]
    [TCP Segment Len: 55]
    Sequence number: 658    (relative sequence number)
    [Next sequence number: 713    (relative sequence number)]
    Acknowledgment number: 138    (relative ack number)
    Header Length: 32 bytes
    .... 0000 0001 1000 = Flags: 0x018 (PSH, ACK)
        000. .... .... = Reserved: Not set
        ...0 .... .... = Nonce: Not set
        .... 0... .... = Congestion Window Reduced (CWR): Not set
        .... .0.. .... = ECN-Echo: Not set
        .... ..0. .... = Urgent: Not set
        .... ...1 .... = Acknowledgment: Set
        .... .... 1... = Push: Set
        .... .... .0.. = Reset: Not set
        .... .... ..0. = Syn: Not set
        .... .... ...0 = Fin: Not set
    Window size value: 237
    [Calculated window size: 30336]
    [Window size scaling factor: 128]
    Checksum: 0x2fdd [validation disabled]
        [Good Checksum: False]
        [Bad Checksum: False]
    Urgent pointer: 0
    Options: (12 bytes), No-Operation (NOP), No-Operation (NOP), Timestamps
        No-Operation (NOP)
            Type: 1
                0... .... = Copy on fragmentation: No
                .00. .... = Class: Control (0)
                ...0 0001 = Number: No-Operation (NOP) (1)
        No-Operation (NOP)
            Type: 1
                0... .... = Copy on fragmentation: No
                .00. .... = Class: Control (0)
                ...0 0001 = Number: No-Operation (NOP) (1)
        Timestamps: TSval 339301832, TSecr 155530555
            Kind: Time Stamp Option (8)
            Length: 10
            Timestamp value: 339301832
            Timestamp echo reply: 155530555
    [SEQ/ACK analysis]
        [iRTT: 0.035942000 seconds]
        [Bytes in flight: 62]
WebSocket
    1... .... = Fin: True
    .000 .... = Reserved: 0x00
    .... 0001 = Opcode: Text (1)
    1... .... = Mask: True
    .011 0001 = Payload length: 49
    Masking-Key: 14eae888
    Payload
        Text: 20d8b3aa6d8584e736c6cabb24dcd1ec23dfdfa5768edfeb...
    Unmask Payload
        [Text unmask: 42["yolo","3069d757-bd7c-45e3-8d03-a978f8623c0f"]]

No.     Time           Source                Destination           Protocol Length Info
    365 3.902460000    104.155.6.9           192.168.0.51          WebSocket 78     WebSocket Text [FIN] 

Frame 365: 78 bytes on wire (624 bits), 78 bytes captured (624 bits) on interface 0
    Interface id: 0 (enp12s0)
    Encapsulation type: Ethernet (1)
    Arrival Time: Dec 22, 2014 15:32:23.216060000 CET
    [Time shift for this packet: 0.000000000 seconds]
    Epoch Time: 1419258743.216060000 seconds
    [Time delta from previous captured frame: 0.000010000 seconds]
    [Time delta from previous displayed frame: 0.034479000 seconds]
    [Time since reference or first frame: 3.902460000 seconds]
    Frame Number: 365
    Frame Length: 78 bytes (624 bits)
    Capture Length: 78 bytes (624 bits)
    [Frame is marked: False]
    [Frame is ignored: False]
    [Protocols in frame: eth:ethertype:ip:tcp:http:websocket]
    [Coloring Rule Name: TCP]
    [Coloring Rule String: tcp]
Ethernet II, Src: 64:66:b3:9e:39:08 (64:66:b3:9e:39:08), Dst: d4:be:d9:74:bf:b6 (d4:be:d9:74:bf:b6)
    Destination: d4:be:d9:74:bf:b6 (d4:be:d9:74:bf:b6)
        Address: d4:be:d9:74:bf:b6 (d4:be:d9:74:bf:b6)
        .... ..0. .... .... .... .... = LG bit: Globally unique address (factory default)
        .... ...0 .... .... .... .... = IG bit: Individual address (unicast)
    Source: 64:66:b3:9e:39:08 (64:66:b3:9e:39:08)
        Address: 64:66:b3:9e:39:08 (64:66:b3:9e:39:08)
        .... ..0. .... .... .... .... = LG bit: Globally unique address (factory default)
        .... ...0 .... .... .... .... = IG bit: Individual address (unicast)
    Type: IP (0x0800)
Internet Protocol Version 4, Src: 104.155.6.9 (104.155.6.9), Dst: 192.168.0.51 (192.168.0.51)
    Version: 4
    Header Length: 20 bytes
    Differentiated Services Field: 0x00 (DSCP 0x00: Default; ECN: 0x00: Not-ECT (Not ECN-Capable Transport))
        0000 00.. = Differentiated Services Codepoint: Default (0x00)
        .... ..00 = Explicit Congestion Notification: Not-ECT (Not ECN-Capable Transport) (0x00)
    Total Length: 64
    Identification: 0x455c (17756)
    Flags: 0x02 (Don't Fragment)
        0... .... = Reserved bit: Not set
        .1.. .... = Don't fragment: Set
        ..0. .... = More fragments: Not set
    Fragment offset: 0
    Time to live: 42
    Protocol: TCP (6)
    Header checksum: 0xdbdc [validation disabled]
        [Good: False]
        [Bad: False]
    Source: 104.155.6.9 (104.155.6.9)
    Destination: 192.168.0.51 (192.168.0.51)
    [Source GeoIP: Unknown]
    [Destination GeoIP: Unknown]
Transmission Control Protocol, Src Port: 8002 (8002), Dst Port: 58512 (58512), Seq: 138, Ack: 658, Len: 12
    Source Port: 8002 (8002)
    Destination Port: 58512 (58512)
    [Stream index: 27]
    [TCP Segment Len: 12]
    Sequence number: 138    (relative sequence number)
    [Next sequence number: 150    (relative sequence number)]
    Acknowledgment number: 658    (relative ack number)
    Header Length: 32 bytes
    .... 0000 0001 1000 = Flags: 0x018 (PSH, ACK)
        000. .... .... = Reserved: Not set
        ...0 .... .... = Nonce: Not set
        .... 0... .... = Congestion Window Reduced (CWR): Not set
        .... .0.. .... = ECN-Echo: Not set
        .... ..0. .... = Urgent: Not set
        .... ...1 .... = Acknowledgment: Set
        .... .... 1... = Push: Set
        .... .... .0.. = Reset: Not set
        .... .... ..0. = Syn: Not set
        .... .... ...0 = Fin: Not set
    Window size value: 480
    [Calculated window size: 15360]
    [Window size scaling factor: 32]
    Checksum: 0x037d [validation disabled]
        [Good Checksum: False]
        [Bad Checksum: False]
    Urgent pointer: 0
    Options: (12 bytes), No-Operation (NOP), No-Operation (NOP), Timestamps
        No-Operation (NOP)
            Type: 1
                0... .... = Copy on fragmentation: No
                .00. .... = Class: Control (0)
                ...0 0001 = Number: No-Operation (NOP) (1)
        No-Operation (NOP)
            Type: 1
                0... .... = Copy on fragmentation: No
                .00. .... = Class: Control (0)
                ...0 0001 = Number: No-Operation (NOP) (1)
        Timestamps: TSval 155530595, TSecr 339301832
            Kind: Time Stamp Option (8)
            Length: 10
            Timestamp value: 155530595
            Timestamp echo reply: 339301832
    [SEQ/ACK analysis]
        [This is an ACK to the segment in frame: 353]
        [The RTT to ACK the segment was: 0.036060000 seconds]
        [iRTT: 0.035942000 seconds]
        [Bytes in flight: 12]
WebSocket
    1... .... = Fin: True
    .000 .... = Reserved: 0x00
    .... 0001 = Opcode: Text (1)
    0... .... = Mask: False
    .000 1010 = Payload length: 10
    Payload
        Text: 42["pong"]

No.     Time           Source                Destination           Protocol Length Info
    372 3.916121000    104.155.6.9           192.168.0.51          WebSocket 86     WebSocket Text [FIN] 

Frame 372: 86 bytes on wire (688 bits), 86 bytes captured (688 bits) on interface 0
    Interface id: 0 (enp12s0)
    Encapsulation type: Ethernet (1)
    Arrival Time: Dec 22, 2014 15:32:23.229721000 CET
    [Time shift for this packet: 0.000000000 seconds]
    Epoch Time: 1419258743.229721000 seconds
    [Time delta from previous captured frame: 0.012256000 seconds]
    [Time delta from previous displayed frame: 0.013661000 seconds]
    [Time since reference or first frame: 3.916121000 seconds]
    Frame Number: 372
    Frame Length: 86 bytes (688 bits)
    Capture Length: 86 bytes (688 bits)
    [Frame is marked: False]
    [Frame is ignored: False]
    [Protocols in frame: eth:ethertype:ip:tcp:http:websocket]
    [Coloring Rule Name: TCP]
    [Coloring Rule String: tcp]
Ethernet II, Src: 64:66:b3:9e:39:08 (64:66:b3:9e:39:08), Dst: d4:be:d9:74:bf:b6 (d4:be:d9:74:bf:b6)
    Destination: d4:be:d9:74:bf:b6 (d4:be:d9:74:bf:b6)
        Address: d4:be:d9:74:bf:b6 (d4:be:d9:74:bf:b6)
        .... ..0. .... .... .... .... = LG bit: Globally unique address (factory default)
        .... ...0 .... .... .... .... = IG bit: Individual address (unicast)
    Source: 64:66:b3:9e:39:08 (64:66:b3:9e:39:08)
        Address: 64:66:b3:9e:39:08 (64:66:b3:9e:39:08)
        .... ..0. .... .... .... .... = LG bit: Globally unique address (factory default)
        .... ...0 .... .... .... .... = IG bit: Individual address (unicast)
    Type: IP (0x0800)
Internet Protocol Version 4, Src: 104.155.6.9 (104.155.6.9), Dst: 192.168.0.51 (192.168.0.51)
    Version: 4
    Header Length: 20 bytes
    Differentiated Services Field: 0x00 (DSCP 0x00: Default; ECN: 0x00: Not-ECT (Not ECN-Capable Transport))
        0000 00.. = Differentiated Services Codepoint: Default (0x00)
        .... ..00 = Explicit Congestion Notification: Not-ECT (Not ECN-Capable Transport) (0x00)
    Total Length: 72
    Identification: 0x455d (17757)
    Flags: 0x02 (Don't Fragment)
        0... .... = Reserved bit: Not set
        .1.. .... = Don't fragment: Set
        ..0. .... = More fragments: Not set
    Fragment offset: 0
    Time to live: 42
    Protocol: TCP (6)
    Header checksum: 0xdbd3 [validation disabled]
        [Good: False]
        [Bad: False]
    Source: 104.155.6.9 (104.155.6.9)
    Destination: 192.168.0.51 (192.168.0.51)
    [Source GeoIP: Unknown]
    [Destination GeoIP: Unknown]
Transmission Control Protocol, Src Port: 8002 (8002), Dst Port: 58512 (58512), Seq: 150, Ack: 713, Len: 20
    Source Port: 8002 (8002)
    Destination Port: 58512 (58512)
    [Stream index: 27]
    [TCP Segment Len: 20]
    Sequence number: 150    (relative sequence number)
    [Next sequence number: 170    (relative sequence number)]
    Acknowledgment number: 713    (relative ack number)
    Header Length: 32 bytes
    .... 0000 0001 1000 = Flags: 0x018 (PSH, ACK)
        000. .... .... = Reserved: Not set
        ...0 .... .... = Nonce: Not set
        .... 0... .... = Congestion Window Reduced (CWR): Not set
        .... .0.. .... = ECN-Echo: Not set
        .... ..0. .... = Urgent: Not set
        .... ...1 .... = Acknowledgment: Set
        .... .... 1... = Push: Set
        .... .... .0.. = Reset: Not set
        .... .... ..0. = Syn: Not set
        .... .... ...0 = Fin: Not set
    Window size value: 480
    [Calculated window size: 15360]
    [Window size scaling factor: 32]
    Checksum: 0xaf39 [validation disabled]
        [Good Checksum: False]
        [Bad Checksum: False]
    Urgent pointer: 0
    Options: (12 bytes), No-Operation (NOP), No-Operation (NOP), Timestamps
        No-Operation (NOP)
            Type: 1
                0... .... = Copy on fragmentation: No
                .00. .... = Class: Control (0)
                ...0 0001 = Number: No-Operation (NOP) (1)
        No-Operation (NOP)
            Type: 1
                0... .... = Copy on fragmentation: No
                .00. .... = Class: Control (0)
                ...0 0001 = Number: No-Operation (NOP) (1)
        Timestamps: TSval 155530598, TSecr 339301832
            Kind: Time Stamp Option (8)
            Length: 10
            Timestamp value: 155530598
            Timestamp echo reply: 339301832
    [SEQ/ACK analysis]
        [This is an ACK to the segment in frame: 354]
        [The RTT to ACK the segment was: 0.048140000 seconds]
        [iRTT: 0.035942000 seconds]
        [Bytes in flight: 20]
WebSocket
    1... .... = Fin: True
    .000 .... = Reserved: 0x00
    .... 0001 = Opcode: Text (1)
    0... .... = Mask: False
    .001 0010 = Payload length: 18
    Payload
        Text: 42["update",[0,0]]

No.     Time           Source                Destination           Protocol Length Info
    414 5.573579000    192.168.0.51          104.155.6.9           WebSocket 86     WebSocket Text [FIN] [MASKED]

Frame 414: 86 bytes on wire (688 bits), 86 bytes captured (688 bits) on interface 0
    Interface id: 0 (enp12s0)
    Encapsulation type: Ethernet (1)
    Arrival Time: Dec 22, 2014 15:32:24.887179000 CET
    [Time shift for this packet: 0.000000000 seconds]
    Epoch Time: 1419258744.887179000 seconds
    [Time delta from previous captured frame: 0.028506000 seconds]
    [Time delta from previous displayed frame: 1.657458000 seconds]
    [Time since reference or first frame: 5.573579000 seconds]
    Frame Number: 414
    Frame Length: 86 bytes (688 bits)
    Capture Length: 86 bytes (688 bits)
    [Frame is marked: False]
    [Frame is ignored: False]
    [Protocols in frame: eth:ethertype:ip:tcp:http:websocket]
    [Coloring Rule Name: TCP]
    [Coloring Rule String: tcp]
Ethernet II, Src: d4:be:d9:74:bf:b6 (d4:be:d9:74:bf:b6), Dst: 64:66:b3:9e:39:08 (64:66:b3:9e:39:08)
    Destination: 64:66:b3:9e:39:08 (64:66:b3:9e:39:08)
        Address: 64:66:b3:9e:39:08 (64:66:b3:9e:39:08)
        .... ..0. .... .... .... .... = LG bit: Globally unique address (factory default)
        .... ...0 .... .... .... .... = IG bit: Individual address (unicast)
    Source: d4:be:d9:74:bf:b6 (d4:be:d9:74:bf:b6)
        Address: d4:be:d9:74:bf:b6 (d4:be:d9:74:bf:b6)
        .... ..0. .... .... .... .... = LG bit: Globally unique address (factory default)
        .... ...0 .... .... .... .... = IG bit: Individual address (unicast)
    Type: IP (0x0800)
Internet Protocol Version 4, Src: 192.168.0.51 (192.168.0.51), Dst: 104.155.6.9 (104.155.6.9)
    Version: 4
    Header Length: 20 bytes
    Differentiated Services Field: 0x00 (DSCP 0x00: Default; ECN: 0x00: Not-ECT (Not ECN-Capable Transport))
        0000 00.. = Differentiated Services Codepoint: Default (0x00)
        .... ..00 = Explicit Congestion Notification: Not-ECT (Not ECN-Capable Transport) (0x00)
    Total Length: 72
    Identification: 0x2005 (8197)
    Flags: 0x02 (Don't Fragment)
        0... .... = Reserved bit: Not set
        .1.. .... = Don't fragment: Set
        ..0. .... = More fragments: Not set
    Fragment offset: 0
    Time to live: 64
    Protocol: TCP (6)
    Header checksum: 0xeb2b [validation disabled]
        [Good: False]
        [Bad: False]
    Source: 192.168.0.51 (192.168.0.51)
    Destination: 104.155.6.9 (104.155.6.9)
    [Source GeoIP: Unknown]
    [Destination GeoIP: Unknown]
Transmission Control Protocol, Src Port: 58512 (58512), Dst Port: 8002 (8002), Seq: 713, Ack: 170, Len: 20
    Source Port: 58512 (58512)
    Destination Port: 8002 (8002)
    [Stream index: 27]
    [TCP Segment Len: 20]
    Sequence number: 713    (relative sequence number)
    [Next sequence number: 733    (relative sequence number)]
    Acknowledgment number: 170    (relative ack number)
    Header Length: 32 bytes
    .... 0000 0001 1000 = Flags: 0x018 (PSH, ACK)
        000. .... .... = Reserved: Not set
        ...0 .... .... = Nonce: Not set
        .... 0... .... = Congestion Window Reduced (CWR): Not set
        .... .0.. .... = ECN-Echo: Not set
        .... ..0. .... = Urgent: Not set
        .... ...1 .... = Acknowledgment: Set
        .... .... 1... = Push: Set
        .... .... .0.. = Reset: Not set
        .... .... ..0. = Syn: Not set
        .... .... ...0 = Fin: Not set
    Window size value: 237
    [Calculated window size: 30336]
    [Window size scaling factor: 128]
    Checksum: 0x2fba [validation disabled]
        [Good Checksum: False]
        [Bad Checksum: False]
    Urgent pointer: 0
    Options: (12 bytes), No-Operation (NOP), No-Operation (NOP), Timestamps
        No-Operation (NOP)
            Type: 1
                0... .... = Copy on fragmentation: No
                .00. .... = Class: Control (0)
                ...0 0001 = Number: No-Operation (NOP) (1)
        No-Operation (NOP)
            Type: 1
                0... .... = Copy on fragmentation: No
                .00. .... = Class: Control (0)
                ...0 0001 = Number: No-Operation (NOP) (1)
        Timestamps: TSval 339302344, TSecr 155530598
            Kind: Time Stamp Option (8)
            Length: 10
            Timestamp value: 339302344
            Timestamp echo reply: 155530598
    [SEQ/ACK analysis]
        [iRTT: 0.035942000 seconds]
        [Bytes in flight: 20]
WebSocket
    1... .... = Fin: True
    .000 .... = Reserved: 0x00
    .... 0001 = Opcode: Text (1)
    1... .... = Mask: True
    .000 1110 = Payload length: 14
    Masking-Key: 3e82e733
    Payload
        Text: 0ab0bc115ded8a5e5fec83561cdf
    Unmask Payload
        [Text unmask: 42["commande"]]

No.     Time           Source                Destination           Protocol Length Info
    416 5.621803000    104.155.6.9           192.168.0.51          WebSocket 87     WebSocket Text [FIN] 

Frame 416: 87 bytes on wire (696 bits), 87 bytes captured (696 bits) on interface 0
    Interface id: 0 (enp12s0)
    Encapsulation type: Ethernet (1)
    Arrival Time: Dec 22, 2014 15:32:24.935403000 CET
    [Time shift for this packet: 0.000000000 seconds]
    Epoch Time: 1419258744.935403000 seconds
    [Time delta from previous captured frame: 0.034009000 seconds]
    [Time delta from previous displayed frame: 0.048224000 seconds]
    [Time since reference or first frame: 5.621803000 seconds]
    Frame Number: 416
    Frame Length: 87 bytes (696 bits)
    Capture Length: 87 bytes (696 bits)
    [Frame is marked: False]
    [Frame is ignored: False]
    [Protocols in frame: eth:ethertype:ip:tcp:http:websocket]
    [Coloring Rule Name: TCP]
    [Coloring Rule String: tcp]
Ethernet II, Src: 64:66:b3:9e:39:08 (64:66:b3:9e:39:08), Dst: d4:be:d9:74:bf:b6 (d4:be:d9:74:bf:b6)
    Destination: d4:be:d9:74:bf:b6 (d4:be:d9:74:bf:b6)
        Address: d4:be:d9:74:bf:b6 (d4:be:d9:74:bf:b6)
        .... ..0. .... .... .... .... = LG bit: Globally unique address (factory default)
        .... ...0 .... .... .... .... = IG bit: Individual address (unicast)
    Source: 64:66:b3:9e:39:08 (64:66:b3:9e:39:08)
        Address: 64:66:b3:9e:39:08 (64:66:b3:9e:39:08)
        .... ..0. .... .... .... .... = LG bit: Globally unique address (factory default)
        .... ...0 .... .... .... .... = IG bit: Individual address (unicast)
    Type: IP (0x0800)
Internet Protocol Version 4, Src: 104.155.6.9 (104.155.6.9), Dst: 192.168.0.51 (192.168.0.51)
    Version: 4
    Header Length: 20 bytes
    Differentiated Services Field: 0x00 (DSCP 0x00: Default; ECN: 0x00: Not-ECT (Not ECN-Capable Transport))
        0000 00.. = Differentiated Services Codepoint: Default (0x00)
        .... ..00 = Explicit Congestion Notification: Not-ECT (Not ECN-Capable Transport) (0x00)
    Total Length: 73
    Identification: 0x455e (17758)
    Flags: 0x02 (Don't Fragment)
        0... .... = Reserved bit: Not set
        .1.. .... = Don't fragment: Set
        ..0. .... = More fragments: Not set
    Fragment offset: 0
    Time to live: 42
    Protocol: TCP (6)
    Header checksum: 0xdbd1 [validation disabled]
        [Good: False]
        [Bad: False]
    Source: 104.155.6.9 (104.155.6.9)
    Destination: 192.168.0.51 (192.168.0.51)
    [Source GeoIP: Unknown]
    [Destination GeoIP: Unknown]
Transmission Control Protocol, Src Port: 8002 (8002), Dst Port: 58512 (58512), Seq: 170, Ack: 733, Len: 21
    Source Port: 8002 (8002)
    Destination Port: 58512 (58512)
    [Stream index: 27]
    [TCP Segment Len: 21]
    Sequence number: 170    (relative sequence number)
    [Next sequence number: 191    (relative sequence number)]
    Acknowledgment number: 733    (relative ack number)
    Header Length: 32 bytes
    .... 0000 0001 1000 = Flags: 0x018 (PSH, ACK)
        000. .... .... = Reserved: Not set
        ...0 .... .... = Nonce: Not set
        .... 0... .... = Congestion Window Reduced (CWR): Not set
        .... .0.. .... = ECN-Echo: Not set
        .... ..0. .... = Urgent: Not set
        .... ...1 .... = Acknowledgment: Set
        .... .... 1... = Push: Set
        .... .... .0.. = Reset: Not set
        .... .... ..0. = Syn: Not set
        .... .... ...0 = Fin: Not set
    Window size value: 480
    [Calculated window size: 15360]
    [Window size scaling factor: 32]
    Checksum: 0x7662 [validation disabled]
        [Good Checksum: False]
        [Bad Checksum: False]
    Urgent pointer: 0
    Options: (12 bytes), No-Operation (NOP), No-Operation (NOP), Timestamps
        No-Operation (NOP)
            Type: 1
                0... .... = Copy on fragmentation: No
                .00. .... = Class: Control (0)
                ...0 0001 = Number: No-Operation (NOP) (1)
        No-Operation (NOP)
            Type: 1
                0... .... = Copy on fragmentation: No
                .00. .... = Class: Control (0)
                ...0 0001 = Number: No-Operation (NOP) (1)
        Timestamps: TSval 155531025, TSecr 339302344
            Kind: Time Stamp Option (8)
            Length: 10
            Timestamp value: 155531025
            Timestamp echo reply: 339302344
    [SEQ/ACK analysis]
        [This is an ACK to the segment in frame: 414]
        [The RTT to ACK the segment was: 0.048224000 seconds]
        [iRTT: 0.035942000 seconds]
        [Bytes in flight: 21]
WebSocket
    1... .... = Fin: True
    .000 .... = Reserved: 0x00
    .... 0001 = Opcode: Text (1)
    0... .... = Mask: False
    .001 0011 = Payload length: 19
    Payload
        Text: 42["update",[1,15]]

No.     Time           Source                Destination           Protocol Length Info
    424 5.938842000    192.168.0.51          104.155.6.9           WebSocket 82     WebSocket Text [FIN] [MASKED]

Frame 424: 82 bytes on wire (656 bits), 82 bytes captured (656 bits) on interface 0
    Interface id: 0 (enp12s0)
    Encapsulation type: Ethernet (1)
    Arrival Time: Dec 22, 2014 15:32:25.252442000 CET
    [Time shift for this packet: 0.000000000 seconds]
    Epoch Time: 1419258745.252442000 seconds
    [Time delta from previous captured frame: 0.197646000 seconds]
    [Time delta from previous displayed frame: 0.317039000 seconds]
    [Time since reference or first frame: 5.938842000 seconds]
    Frame Number: 424
    Frame Length: 82 bytes (656 bits)
    Capture Length: 82 bytes (656 bits)
    [Frame is marked: False]
    [Frame is ignored: False]
    [Protocols in frame: eth:ethertype:ip:tcp:http:websocket]
    [Coloring Rule Name: TCP]
    [Coloring Rule String: tcp]
Ethernet II, Src: d4:be:d9:74:bf:b6 (d4:be:d9:74:bf:b6), Dst: 64:66:b3:9e:39:08 (64:66:b3:9e:39:08)
    Destination: 64:66:b3:9e:39:08 (64:66:b3:9e:39:08)
        Address: 64:66:b3:9e:39:08 (64:66:b3:9e:39:08)
        .... ..0. .... .... .... .... = LG bit: Globally unique address (factory default)
        .... ...0 .... .... .... .... = IG bit: Individual address (unicast)
    Source: d4:be:d9:74:bf:b6 (d4:be:d9:74:bf:b6)
        Address: d4:be:d9:74:bf:b6 (d4:be:d9:74:bf:b6)
        .... ..0. .... .... .... .... = LG bit: Globally unique address (factory default)
