Frame 347: 78 bytes on wire (624 bits), 78 bytes captured (624 bits) on interface 0
Ethernet II, Src: d4:be:d9:74:bf:b6 (d4:be:d9:74:bf:b6), Dst: 64:66:b3:9e:39:08 (64:66:b3:9e:39:08)
Internet Protocol Version 4, Src: 192.168.0.51 (192.168.0.51), Dst: 104.155.6.9 (104.155.6.9)
Transmission Control Protocol, Src Port: 38173 (38173), Dst Port: 8001 (8001), Seq: 639, Ack: 130, Len: 12
    Source Port: 38173 (38173)
    Destination Port: 8001 (8001)
    [Stream index: 40]
    [TCP Segment Len: 12]
    Sequence number: 639    (relative sequence number)
    [Next sequence number: 651    (relative sequence number)]
    Acknowledgment number: 130    (relative ack number)
    Header Length: 32 bytes
    .... 0000 0001 1000 = Flags: 0x018 (PSH, ACK)
    Window size value: 237
    [Calculated window size: 30336]
    [Window size scaling factor: 128]
    Checksum: 0x2fb2 [validation disabled]
    Urgent pointer: 0
    Options: (12 bytes), No-Operation (NOP), No-Operation (NOP), Timestamps
        No-Operation (NOP)
        No-Operation (NOP)
        Timestamps: TSval 180775849, TSecr 23424605
            Kind: Time Stamp Option (8)
            Length: 10
            Timestamp value: 180775849
            Timestamp echo reply: 23424605
    [SEQ/ACK analysis]
WebSocket
    1... .... = Fin: True
    .000 .... = Reserved: 0x00
    .... 0001 = Opcode: Text (1)
    1... .... = Mask: True
    .000 0110 = Payload length: 6
    Masking-Key: 61fc6f8b
    Payload
        Text: 538c1de40399
    Unmask Payload

Frame 352: 74 bytes on wire (592 bits), 74 bytes captured (592 bits) on interface 0
Ethernet II, Src: 64:66:b3:9e:39:08 (64:66:b3:9e:39:08), Dst: d4:be:d9:74:bf:b6 (d4:be:d9:74:bf:b6)
Internet Protocol Version 4, Src: 104.155.6.9 (104.155.6.9), Dst: 192.168.0.51 (192.168.0.51)
Transmission Control Protocol, Src Port: 8001 (8001), Dst Port: 38173 (38173), Seq: 130, Ack: 651, Len: 8
    Source Port: 8001 (8001)
    Destination Port: 38173 (38173)
    [Stream index: 40]
    [TCP Segment Len: 8]
    Sequence number: 130    (relative sequence number)
    [Next sequence number: 138    (relative sequence number)]
    Acknowledgment number: 651    (relative ack number)
    Header Length: 32 bytes
    .... 0000 0001 1000 = Flags: 0x018 (PSH, ACK)
    Window size value: 480
    [Calculated window size: 15360]
    [Window size scaling factor: 32]
    Checksum: 0xfd0c [validation disabled]
    Urgent pointer: 0
    Options: (12 bytes), No-Operation (NOP), No-Operation (NOP), Timestamps
        No-Operation (NOP)
        No-Operation (NOP)
        Timestamps: TSval 23424646, TSecr 180775849
            Kind: Time Stamp Option (8)
            Length: 10
            Timestamp value: 23424646
            Timestamp echo reply: 180775849
    [SEQ/ACK analysis]
WebSocket
    1... .... = Fin: True
    .000 .... = Reserved: 0x00
    .... 0001 = Opcode: Text (1)
    0... .... = Mask: False
    .000 0110 = Payload length: 6
    Payload
        Text: 3probe

Frame 376: 73 bytes on wire (584 bits), 73 bytes captured (584 bits) on interface 0
Ethernet II, Src: d4:be:d9:74:bf:b6 (d4:be:d9:74:bf:b6), Dst: 64:66:b3:9e:39:08 (64:66:b3:9e:39:08)
Internet Protocol Version 4, Src: 192.168.0.51 (192.168.0.51), Dst: 104.155.6.9 (104.155.6.9)
Transmission Control Protocol, Src Port: 38173 (38173), Dst Port: 8001 (8001), Seq: 651, Ack: 138, Len: 7
    Source Port: 38173 (38173)
    Destination Port: 8001 (8001)
    [Stream index: 40]
    [TCP Segment Len: 7]
    Sequence number: 651    (relative sequence number)
    [Next sequence number: 658    (relative sequence number)]
    Acknowledgment number: 138    (relative ack number)
    Header Length: 32 bytes
    .... 0000 0001 1000 = Flags: 0x018 (PSH, ACK)
    Window size value: 237
    [Calculated window size: 30336]
    [Window size scaling factor: 128]
    Checksum: 0x2fad [validation disabled]
    Urgent pointer: 0
    Options: (12 bytes), No-Operation (NOP), No-Operation (NOP), Timestamps
        No-Operation (NOP)
        No-Operation (NOP)
        Timestamps: TSval 180775901, TSecr 23424646
            Kind: Time Stamp Option (8)
            Length: 10
            Timestamp value: 180775901
            Timestamp echo reply: 23424646
    [SEQ/ACK analysis]
WebSocket
    1... .... = Fin: True
    .000 .... = Reserved: 0x00
    .... 0001 = Opcode: Text (1)
    1... .... = Mask: True
    .000 0001 = Payload length: 1
    Masking-Key: 20f8e66e
    Payload
        Text: 15
    Unmask Payload

Frame 377: 121 bytes on wire (968 bits), 121 bytes captured (968 bits) on interface 0
Ethernet II, Src: d4:be:d9:74:bf:b6 (d4:be:d9:74:bf:b6), Dst: 64:66:b3:9e:39:08 (64:66:b3:9e:39:08)
Internet Protocol Version 4, Src: 192.168.0.51 (192.168.0.51), Dst: 104.155.6.9 (104.155.6.9)
Transmission Control Protocol, Src Port: 38173 (38173), Dst Port: 8001 (8001), Seq: 658, Ack: 138, Len: 55
    Source Port: 38173 (38173)
    Destination Port: 8001 (8001)
    [Stream index: 40]
    [TCP Segment Len: 55]
    Sequence number: 658    (relative sequence number)
    [Next sequence number: 713    (relative sequence number)]
    Acknowledgment number: 138    (relative ack number)
    Header Length: 32 bytes
    .... 0000 0001 1000 = Flags: 0x018 (PSH, ACK)
    Window size value: 237
    [Calculated window size: 30336]
    [Window size scaling factor: 128]
    Checksum: 0x2fdd [validation disabled]
    Urgent pointer: 0
    Options: (12 bytes), No-Operation (NOP), No-Operation (NOP), Timestamps
        No-Operation (NOP)
        No-Operation (NOP)
        Timestamps: TSval 180775902, TSecr 23424646
            Kind: Time Stamp Option (8)
            Length: 10
            Timestamp value: 180775902
            Timestamp echo reply: 23424646
    [SEQ/ACK analysis]
WebSocket
    1... .... = Fin: True
    .000 .... = Reserved: 0x00
    .... 0001 = Opcode: Text (1)
    1... .... = Mask: True
    .011 0001 = Payload length: 49
    Masking-Key: 44250c03
    Payload
        Text: 701757213d4a606c66092e66754435327d473f2e21113530...
    Unmask Payload

Frame 379: 78 bytes on wire (624 bits), 78 bytes captured (624 bits) on interface 0
Ethernet II, Src: 64:66:b3:9e:39:08 (64:66:b3:9e:39:08), Dst: d4:be:d9:74:bf:b6 (d4:be:d9:74:bf:b6)
Internet Protocol Version 4, Src: 104.155.6.9 (104.155.6.9), Dst: 192.168.0.51 (192.168.0.51)
Transmission Control Protocol, Src Port: 8001 (8001), Dst Port: 38173 (38173), Seq: 138, Ack: 658, Len: 12
    Source Port: 8001 (8001)
    Destination Port: 38173 (38173)
    [Stream index: 40]
    [TCP Segment Len: 12]
    Sequence number: 138    (relative sequence number)
    [Next sequence number: 150    (relative sequence number)]
    Acknowledgment number: 658    (relative ack number)
    Header Length: 32 bytes
    .... 0000 0001 1000 = Flags: 0x018 (PSH, ACK)
    Window size value: 480
    [Calculated window size: 15360]
    [Window size scaling factor: 32]
    Checksum: 0x7453 [validation disabled]
    Urgent pointer: 0
    Options: (12 bytes), No-Operation (NOP), No-Operation (NOP), Timestamps
        No-Operation (NOP)
        No-Operation (NOP)
        Timestamps: TSval 23424689, TSecr 180775901
            Kind: Time Stamp Option (8)
            Length: 10
            Timestamp value: 23424689
            Timestamp echo reply: 180775901
    [SEQ/ACK analysis]
WebSocket
    1... .... = Fin: True
    .000 .... = Reserved: 0x00
    .... 0001 = Opcode: Text (1)
    0... .... = Mask: False
    .000 1010 = Payload length: 10
    Payload
        Text: 42["pong"]

Frame 387: 95 bytes on wire (760 bits), 95 bytes captured (760 bits) on interface 0
Ethernet II, Src: 64:66:b3:9e:39:08 (64:66:b3:9e:39:08), Dst: d4:be:d9:74:bf:b6 (d4:be:d9:74:bf:b6)
Internet Protocol Version 4, Src: 104.155.6.9 (104.155.6.9), Dst: 192.168.0.51 (192.168.0.51)
Transmission Control Protocol, Src Port: 8001 (8001), Dst Port: 38173 (38173), Seq: 150, Ack: 713, Len: 29
    Source Port: 8001 (8001)
    Destination Port: 38173 (38173)
    [Stream index: 40]
    [TCP Segment Len: 29]
    Sequence number: 150    (relative sequence number)
    [Next sequence number: 179    (relative sequence number)]
    Acknowledgment number: 713    (relative ack number)
    Header Length: 32 bytes
    .... 0000 0001 1000 = Flags: 0x018 (PSH, ACK)
    Window size value: 480
    [Calculated window size: 15360]
    [Window size scaling factor: 32]
    Checksum: 0x0510 [validation disabled]
    Urgent pointer: 0
    Options: (12 bytes), No-Operation (NOP), No-Operation (NOP), Timestamps
        No-Operation (NOP)
        No-Operation (NOP)
        Timestamps: TSval 23424699, TSecr 180775902
            Kind: Time Stamp Option (8)
            Length: 10
            Timestamp value: 23424699
            Timestamp echo reply: 180775902
    [SEQ/ACK analysis]
WebSocket
    1... .... = Fin: True
    .000 .... = Reserved: 0x00
    .... 0001 = Opcode: Text (1)
    0... .... = Mask: False
    .001 1011 = Payload length: 27
    Payload
        Text: 42["update",[0,0,0,[],0.5]]

Frame 390: 95 bytes on wire (760 bits), 95 bytes captured (760 bits) on interface 0
Ethernet II, Src: 64:66:b3:9e:39:08 (64:66:b3:9e:39:08), Dst: d4:be:d9:74:bf:b6 (d4:be:d9:74:bf:b6)
Internet Protocol Version 4, Src: 104.155.6.9 (104.155.6.9), Dst: 192.168.0.51 (192.168.0.51)
Transmission Control Protocol, Src Port: 8001 (8001), Dst Port: 38173 (38173), Seq: 179, Ack: 713, Len: 29
    Source Port: 8001 (8001)
    Destination Port: 38173 (38173)
    [Stream index: 40]
    [TCP Segment Len: 29]
    Sequence number: 179    (relative sequence number)
    [Next sequence number: 208    (relative sequence number)]
    Acknowledgment number: 713    (relative ack number)
    Header Length: 32 bytes
    .... 0000 0001 1000 = Flags: 0x018 (PSH, ACK)
    Window size value: 480
    [Calculated window size: 15360]
    [Window size scaling factor: 32]
    Checksum: 0x04d3 [validation disabled]
    Urgent pointer: 0
    Options: (12 bytes), No-Operation (NOP), No-Operation (NOP), Timestamps
        No-Operation (NOP)
        No-Operation (NOP)
        Timestamps: TSval 23424710, TSecr 180775923
            Kind: Time Stamp Option (8)
            Length: 10
            Timestamp value: 23424710
            Timestamp echo reply: 180775923
    [SEQ/ACK analysis]
WebSocket
    1... .... = Fin: True
    .000 .... = Reserved: 0x00
    .... 0001 = Opcode: Text (1)
    0... .... = Mask: False
    .001 1011 = Payload length: 27
    Payload
        Text: 42["update",[0,0,0,[],0.5]]

Frame 406: 95 bytes on wire (760 bits), 95 bytes captured (760 bits) on interface 0
Ethernet II, Src: 64:66:b3:9e:39:08 (64:66:b3:9e:39:08), Dst: d4:be:d9:74:bf:b6 (d4:be:d9:74:bf:b6)
Internet Protocol Version 4, Src: 104.155.6.9 (104.155.6.9), Dst: 192.168.0.51 (192.168.0.51)
Transmission Control Protocol, Src Port: 8001 (8001), Dst Port: 38173 (38173), Seq: 208, Ack: 713, Len: 29
    Source Port: 8001 (8001)
    Destination Port: 38173 (38173)
    [Stream index: 40]
    [TCP Segment Len: 29]
    Sequence number: 208    (relative sequence number)
    [Next sequence number: 237    (relative sequence number)]
    Acknowledgment number: 713    (relative ack number)
    Header Length: 32 bytes
    .... 0000 0001 1000 = Flags: 0x018 (PSH, ACK)
    Window size value: 480
    [Calculated window size: 15360]
    [Window size scaling factor: 32]
    Checksum: 0x049c [validation disabled]
    Urgent pointer: 0
    Options: (12 bytes), No-Operation (NOP), No-Operation (NOP), Timestamps
        No-Operation (NOP)
        No-Operation (NOP)
        Timestamps: TSval 23424722, TSecr 180775937
            Kind: Time Stamp Option (8)
            Length: 10
            Timestamp value: 23424722
            Timestamp echo reply: 180775937
    [SEQ/ACK analysis]
WebSocket
    1... .... = Fin: True
    .000 .... = Reserved: 0x00
    .... 0001 = Opcode: Text (1)
    0... .... = Mask: False
    .001 1011 = Payload length: 27
    Payload
        Text: 42["update",[0,0,0,[],0.5]]

Frame 417: 95 bytes on wire (760 bits), 95 bytes captured (760 bits) on interface 0
Ethernet II, Src: 64:66:b3:9e:39:08 (64:66:b3:9e:39:08), Dst: d4:be:d9:74:bf:b6 (d4:be:d9:74:bf:b6)
Internet Protocol Version 4, Src: 104.155.6.9 (104.155.6.9), Dst: 192.168.0.51 (192.168.0.51)
Transmission Control Protocol, Src Port: 8001 (8001), Dst Port: 38173 (38173), Seq: 237, Ack: 713, Len: 29
    Source Port: 8001 (8001)
    Destination Port: 38173 (38173)
    [Stream index: 40]
    [TCP Segment Len: 29]
    Sequence number: 237    (relative sequence number)
    [Next sequence number: 266    (relative sequence number)]
    Acknowledgment number: 713    (relative ack number)
    Header Length: 32 bytes
    .... 0000 0001 1000 = Flags: 0x018 (PSH, ACK)
    Window size value: 480
    [Calculated window size: 15360]
    [Window size scaling factor: 32]
    Checksum: 0x0466 [validation disabled]
    Urgent pointer: 0
    Options: (12 bytes), No-Operation (NOP), No-Operation (NOP), Timestamps
        No-Operation (NOP)
        No-Operation (NOP)
        Timestamps: TSval 23424733, TSecr 180775951
            Kind: Time Stamp Option (8)
            Length: 10
            Timestamp value: 23424733
            Timestamp echo reply: 180775951
    [SEQ/ACK analysis]
WebSocket
    1... .... = Fin: True
    .000 .... = Reserved: 0x00
    .... 0001 = Opcode: Text (1)
    0... .... = Mask: False
    .001 1011 = Payload length: 27
    Payload
        Text: 42["update",[0,0,0,[],0.5]]

Frame 422: 95 bytes on wire (760 bits), 95 bytes captured (760 bits) on interface 0
Ethernet II, Src: 64:66:b3:9e:39:08 (64:66:b3:9e:39:08), Dst: d4:be:d9:74:bf:b6 (d4:be:d9:74:bf:b6)
Internet Protocol Version 4, Src: 104.155.6.9 (104.155.6.9), Dst: 192.168.0.51 (192.168.0.51)
Transmission Control Protocol, Src Port: 8001 (8001), Dst Port: 38173 (38173), Seq: 266, Ack: 713, Len: 29
    Source Port: 8001 (8001)
    Destination Port: 38173 (38173)
    [Stream index: 40]
    [TCP Segment Len: 29]
    Sequence number: 266    (relative sequence number)
    [Next sequence number: 295    (relative sequence number)]
    Acknowledgment number: 713    (relative ack number)
    Header Length: 32 bytes
    .... 0000 0001 1000 = Flags: 0x018 (PSH, ACK)
    Window size value: 480
    [Calculated window size: 15360]
    [Window size scaling factor: 32]
    Checksum: 0x0431 [validation disabled]
    Urgent pointer: 0
    Options: (12 bytes), No-Operation (NOP), No-Operation (NOP), Timestamps
        No-Operation (NOP)
        No-Operation (NOP)
        Timestamps: TSval 23424744, TSecr 180775964
            Kind: Time Stamp Option (8)
            Length: 10
            Timestamp value: 23424744
            Timestamp echo reply: 180775964
    [SEQ/ACK analysis]
WebSocket
    1... .... = Fin: True
    .000 .... = Reserved: 0x00
    .... 0001 = Opcode: Text (1)
    0... .... = Mask: False
    .001 1011 = Payload length: 27
    Payload
        Text: 42["update",[0,0,0,[],0.5]]

Frame 427: 95 bytes on wire (760 bits), 95 bytes captured (760 bits) on interface 0
Ethernet II, Src: 64:66:b3:9e:39:08 (64:66:b3:9e:39:08), Dst: d4:be:d9:74:bf:b6 (d4:be:d9:74:bf:b6)
Internet Protocol Version 4, Src: 104.155.6.9 (104.155.6.9), Dst: 192.168.0.51 (192.168.0.51)
Transmission Control Protocol, Src Port: 8001 (8001), Dst Port: 38173 (38173), Seq: 295, Ack: 713, Len: 29
    Source Port: 8001 (8001)
    Destination Port: 38173 (38173)
    [Stream index: 40]
    [TCP Segment Len: 29]
    Sequence number: 295    (relative sequence number)
    [Next sequence number: 324    (relative sequence number)]
    Acknowledgment number: 713    (relative ack number)
    Header Length: 32 bytes
    .... 0000 0001 1000 = Flags: 0x018 (PSH, ACK)
    Window size value: 480
    [Calculated window size: 15360]
    [Window size scaling factor: 32]
    Checksum: 0x03fa [validation disabled]
    Urgent pointer: 0
    Options: (12 bytes), No-Operation (NOP), No-Operation (NOP), Timestamps
        No-Operation (NOP)
        No-Operation (NOP)
        Timestamps: TSval 23424756, TSecr 180775978
            Kind: Time Stamp Option (8)
            Length: 10
            Timestamp value: 23424756
            Timestamp echo reply: 180775978
    [SEQ/ACK analysis]
WebSocket
    1... .... = Fin: True
    .000 .... = Reserved: 0x00
    .... 0001 = Opcode: Text (1)
    0... .... = Mask: False
    .001 1011 = Payload length: 27
    Payload
        Text: 42["update",[0,0,0,[],0.5]]

Frame 431: 95 bytes on wire (760 bits), 95 bytes captured (760 bits) on interface 0
Ethernet II, Src: 64:66:b3:9e:39:08 (64:66:b3:9e:39:08), Dst: d4:be:d9:74:bf:b6 (d4:be:d9:74:bf:b6)
Internet Protocol Version 4, Src: 104.155.6.9 (104.155.6.9), Dst: 192.168.0.51 (192.168.0.51)
Transmission Control Protocol, Src Port: 8001 (8001), Dst Port: 38173 (38173), Seq: 324, Ack: 713, Len: 29
    Source Port: 8001 (8001)
    Destination Port: 38173 (38173)
    [Stream index: 40]
    [TCP Segment Len: 29]
    Sequence number: 324    (relative sequence number)
    [Next sequence number: 353    (relative sequence number)]
    Acknowledgment number: 713    (relative ack number)
    Header Length: 32 bytes
    .... 0000 0001 1000 = Flags: 0x018 (PSH, ACK)
    Window size value: 480
    [Calculated window size: 15360]
    [Window size scaling factor: 32]
    Checksum: 0x03c4 [validation disabled]
    Urgent pointer: 0
    Options: (12 bytes), No-Operation (NOP), No-Operation (NOP), Timestamps
        No-Operation (NOP)
        No-Operation (NOP)
        Timestamps: TSval 23424767, TSecr 180775992
            Kind: Time Stamp Option (8)
            Length: 10
            Timestamp value: 23424767
            Timestamp echo reply: 180775992
    [SEQ/ACK analysis]
WebSocket
    1... .... = Fin: True
    .000 .... = Reserved: 0x00
    .... 0001 = Opcode: Text (1)
    0... .... = Mask: False
    .001 1011 = Payload length: 27
    Payload
        Text: 42["update",[0,0,0,[],0.5]]

Frame 434: 95 bytes on wire (760 bits), 95 bytes captured (760 bits) on interface 0
Ethernet II, Src: 64:66:b3:9e:39:08 (64:66:b3:9e:39:08), Dst: d4:be:d9:74:bf:b6 (d4:be:d9:74:bf:b6)
Internet Protocol Version 4, Src: 104.155.6.9 (104.155.6.9), Dst: 192.168.0.51 (192.168.0.51)
Transmission Control Protocol, Src Port: 8001 (8001), Dst Port: 38173 (38173), Seq: 353, Ack: 713, Len: 29
    Source Port: 8001 (8001)
    Destination Port: 38173 (38173)
    [Stream index: 40]
    [TCP Segment Len: 29]
    Sequence number: 353    (relative sequence number)
    [Next sequence number: 382    (relative sequence number)]
    Acknowledgment number: 713    (relative ack number)
    Header Length: 32 bytes
    .... 0000 0001 1000 = Flags: 0x018 (PSH, ACK)
    Window size value: 480
    [Calculated window size: 15360]
    [Window size scaling factor: 32]
    Checksum: 0x038d [validation disabled]
    Urgent pointer: 0
    Options: (12 bytes), No-Operation (NOP), No-Operation (NOP), Timestamps
        No-Operation (NOP)
        No-Operation (NOP)
        Timestamps: TSval 23424779, TSecr 180776006
            Kind: Time Stamp Option (8)
            Length: 10
            Timestamp value: 23424779
            Timestamp echo reply: 180776006
    [SEQ/ACK analysis]
WebSocket
    1... .... = Fin: True
    .000 .... = Reserved: 0x00
    .... 0001 = Opcode: Text (1)
    0... .... = Mask: False
    .001 1011 = Payload length: 27
    Payload
        Text: 42["update",[0,0,0,[],0.5]]

Frame 437: 95 bytes on wire (760 bits), 95 bytes captured (760 bits) on interface 0
Ethernet II, Src: 64:66:b3:9e:39:08 (64:66:b3:9e:39:08), Dst: d4:be:d9:74:bf:b6 (d4:be:d9:74:bf:b6)
Internet Protocol Version 4, Src: 104.155.6.9 (104.155.6.9), Dst: 192.168.0.51 (192.168.0.51)
Transmission Control Protocol, Src Port: 8001 (8001), Dst Port: 38173 (38173), Seq: 382, Ack: 713, Len: 29
    Source Port: 8001 (8001)
    Destination Port: 38173 (38173)
    [Stream index: 40]
    [TCP Segment Len: 29]
    Sequence number: 382    (relative sequence number)
    [Next sequence number: 411    (relative sequence number)]
    Acknowledgment number: 713    (relative ack number)
    Header Length: 32 bytes
    .... 0000 0001 1000 = Flags: 0x018 (PSH, ACK)
    Window size value: 480
    [Calculated window size: 15360]
    [Window size scaling factor: 32]
    Checksum: 0x0358 [validation disabled]
    Urgent pointer: 0
    Options: (12 bytes), No-Operation (NOP), No-Operation (NOP), Timestamps
        No-Operation (NOP)
        No-Operation (NOP)
        Timestamps: TSval 23424790, TSecr 180776019
            Kind: Time Stamp Option (8)
            Length: 10
            Timestamp value: 23424790
            Timestamp echo reply: 180776019
    [SEQ/ACK analysis]
WebSocket
    1... .... = Fin: True
    .000 .... = Reserved: 0x00
    .... 0001 = Opcode: Text (1)
    0... .... = Mask: False
    .001 1011 = Payload length: 27
    Payload
        Text: 42["update",[0,0,0,[],0.5]]

Frame 439: 95 bytes on wire (760 bits), 95 bytes captured (760 bits) on interface 0
Ethernet II, Src: 64:66:b3:9e:39:08 (64:66:b3:9e:39:08), Dst: d4:be:d9:74:bf:b6 (d4:be:d9:74:bf:b6)
Internet Protocol Version 4, Src: 104.155.6.9 (104.155.6.9), Dst: 192.168.0.51 (192.168.0.51)
Transmission Control Protocol, Src Port: 8001 (8001), Dst Port: 38173 (38173), Seq: 411, Ack: 713, Len: 29
    Source Port: 8001 (8001)
    Destination Port: 38173 (38173)
    [Stream index: 40]
    [TCP Segment Len: 29]
    Sequence number: 411    (relative sequence number)
    [Next sequence number: 440    (relative sequence number)]
    Acknowledgment number: 713    (relative ack number)
    Header Length: 32 bytes
    .... 0000 0001 1000 = Flags: 0x018 (PSH, ACK)
    Window size value: 480
    [Calculated window size: 15360]
    [Window size scaling factor: 32]
    Checksum: 0x0322 [validation disabled]
    Urgent pointer: 0
    Options: (12 bytes), No-Operation (NOP), No-Operation (NOP), Timestamps
        No-Operation (NOP)
        No-Operation (NOP)
        Timestamps: TSval 23424801, TSecr 180776033
            Kind: Time Stamp Option (8)
            Length: 10
            Timestamp value: 23424801
            Timestamp echo reply: 180776033
    [SEQ/ACK analysis]
WebSocket
    1... .... = Fin: True
    .000 .... = Reserved: 0x00
    .... 0001 = Opcode: Text (1)
    0... .... = Mask: False
    .001 1011 = Payload length: 27
    Payload
        Text: 42["update",[0,0,0,[],0.5]]

Frame 444: 95 bytes on wire (760 bits), 95 bytes captured (760 bits) on interface 0
Ethernet II, Src: 64:66:b3:9e:39:08 (64:66:b3:9e:39:08), Dst: d4:be:d9:74:bf:b6 (d4:be:d9:74:bf:b6)
Internet Protocol Version 4, Src: 104.155.6.9 (104.155.6.9), Dst: 192.168.0.51 (192.168.0.51)
Transmission Control Protocol, Src Port: 8001 (8001), Dst Port: 38173 (38173), Seq: 440, Ack: 713, Len: 29
    Source Port: 8001 (8001)
    Destination Port: 38173 (38173)
    [Stream index: 40]
    [TCP Segment Len: 29]
    Sequence number: 440    (relative sequence number)
    [Next sequence number: 469    (relative sequence number)]
    Acknowledgment number: 713    (relative ack number)
    Header Length: 32 bytes
    .... 0000 0001 1000 = Flags: 0x018 (PSH, ACK)
    Window size value: 480
    [Calculated window size: 15360]
    [Window size scaling factor: 32]
    Checksum: 0x02ec [validation disabled]
    Urgent pointer: 0
    Options: (12 bytes), No-Operation (NOP), No-Operation (NOP), Timestamps
        No-Operation (NOP)
        No-Operation (NOP)
        Timestamps: TSval 23424813, TSecr 180776046
            Kind: Time Stamp Option (8)
            Length: 10
            Timestamp value: 23424813
            Timestamp echo reply: 180776046
    [SEQ/ACK analysis]
WebSocket
    1... .... = Fin: True
    .000 .... = Reserved: 0x00
    .... 0001 = Opcode: Text (1)
    0... .... = Mask: False
    .001 1011 = Payload length: 27
    Payload
        Text: 42["update",[0,0,0,[],0.5]]

Frame 446: 95 bytes on wire (760 bits), 95 bytes captured (760 bits) on interface 0
Ethernet II, Src: 64:66:b3:9e:39:08 (64:66:b3:9e:39:08), Dst: d4:be:d9:74:bf:b6 (d4:be:d9:74:bf:b6)
Internet Protocol Version 4, Src: 104.155.6.9 (104.155.6.9), Dst: 192.168.0.51 (192.168.0.51)
Transmission Control Protocol, Src Port: 8001 (8001), Dst Port: 38173 (38173), Seq: 469, Ack: 713, Len: 29
    Source Port: 8001 (8001)
    Destination Port: 38173 (38173)
    [Stream index: 40]
    [TCP Segment Len: 29]
    Sequence number: 469    (relative sequence number)
    [Next sequence number: 498    (relative sequence number)]
    Acknowledgment number: 713    (relative ack number)
    Header Length: 32 bytes
    .... 0000 0001 1000 = Flags: 0x018 (PSH, ACK)
    Window size value: 480
    [Calculated window size: 15360]
    [Window size scaling factor: 32]
    Checksum: 0x02b6 [validation disabled]
    Urgent pointer: 0
    Options: (12 bytes), No-Operation (NOP), No-Operation (NOP), Timestamps
        No-Operation (NOP)
        No-Operation (NOP)
        Timestamps: TSval 23424824, TSecr 180776060
            Kind: Time Stamp Option (8)
            Length: 10
            Timestamp value: 23424824
            Timestamp echo reply: 180776060
    [SEQ/ACK analysis]
WebSocket
    1... .... = Fin: True
    .000 .... = Reserved: 0x00
    .... 0001 = Opcode: Text (1)
    0... .... = Mask: False
    .001 1011 = Payload length: 27
    Payload
        Text: 42["update",[0,0,0,[],0.5]]

Frame 448: 95 bytes on wire (760 bits), 95 bytes captured (760 bits) on interface 0
Ethernet II, Src: 64:66:b3:9e:39:08 (64:66:b3:9e:39:08), Dst: d4:be:d9:74:bf:b6 (d4:be:d9:74:bf:b6)
Internet Protocol Version 4, Src: 104.155.6.9 (104.155.6.9), Dst: 192.168.0.51 (192.168.0.51)
Transmission Control Protocol, Src Port: 8001 (8001), Dst Port: 38173 (38173), Seq: 498, Ack: 713, Len: 29
    Source Port: 8001 (8001)
    Destination Port: 38173 (38173)
    [Stream index: 40]
    [TCP Segment Len: 29]
    Sequence number: 498    (relative sequence number)
    [Next sequence number: 527    (relative sequence number)]
    Acknowledgment number: 713    (relative ack number)
    Header Length: 32 bytes
    .... 0000 0001 1000 = Flags: 0x018 (PSH, ACK)
    Window size value: 480
    [Calculated window size: 15360]
    [Window size scaling factor: 32]
    Checksum: 0x0280 [validation disabled]
    Urgent pointer: 0
    Options: (12 bytes), No-Operation (NOP), No-Operation (NOP), Timestamps
        No-Operation (NOP)
        No-Operation (NOP)
        Timestamps: TSval 23424835, TSecr 180776074
            Kind: Time Stamp Option (8)
            Length: 10
            Timestamp value: 23424835
            Timestamp echo reply: 180776074
    [SEQ/ACK analysis]
WebSocket
    1... .... = Fin: True
    .000 .... = Reserved: 0x00
    .... 0001 = Opcode: Text (1)
    0... .... = Mask: False
    .001 1011 = Payload length: 27
    Payload
        Text: 42["update",[0,0,0,[],0.5]]

Frame 450: 95 bytes on wire (760 bits), 95 bytes captured (760 bits) on interface 0
Ethernet II, Src: 64:66:b3:9e:39:08 (64:66:b3:9e:39:08), Dst: d4:be:d9:74:bf:b6 (d4:be:d9:74:bf:b6)
Internet Protocol Version 4, Src: 104.155.6.9 (104.155.6.9), Dst: 192.168.0.51 (192.168.0.51)
Transmission Control Protocol, Src Port: 8001 (8001), Dst Port: 38173 (38173), Seq: 527, Ack: 713, Len: 29
    Source Port: 8001 (8001)
    Destination Port: 38173 (38173)
    [Stream index: 40]
    [TCP Segment Len: 29]
    Sequence number: 527    (relative sequence number)
    [Next sequence number: 556    (relative sequence number)]
    Acknowledgment number: 713    (relative ack number)
    Header Length: 32 bytes
    .... 0000 0001 1000 = Flags: 0x018 (PSH, ACK)
    Window size value: 480
    [Calculated window size: 15360]
    [Window size scaling factor: 32]
    Checksum: 0x0249 [validation disabled]
    Urgent pointer: 0
    Options: (12 bytes), No-Operation (NOP), No-Operation (NOP), Timestamps
        No-Operation (NOP)
        No-Operation (NOP)
        Timestamps: TSval 23424847, TSecr 180776088
            Kind: Time Stamp Option (8)
            Length: 10
            Timestamp value: 23424847
            Timestamp echo reply: 180776088
    [SEQ/ACK analysis]
WebSocket
    1... .... = Fin: True
    .000 .... = Reserved: 0x00
    .... 0001 = Opcode: Text (1)
    0... .... = Mask: False
    .001 1011 = Payload length: 27
    Payload
        Text: 42["update",[0,0,0,[],0.5]]

Frame 453: 95 bytes on wire (760 bits), 95 bytes captured (760 bits) on interface 0
Ethernet II, Src: 64:66:b3:9e:39:08 (64:66:b3:9e:39:08), Dst: d4:be:d9:74:bf:b6 (d4:be:d9:74:bf:b6)
Internet Protocol Version 4, Src: 104.155.6.9 (104.155.6.9), Dst: 192.168.0.51 (192.168.0.51)
Transmission Control Protocol, Src Port: 8001 (8001), Dst Port: 38173 (38173), Seq: 556, Ack: 713, Len: 29
    Source Port: 8001 (8001)
    Destination Port: 38173 (38173)
    [Stream index: 40]
    [TCP Segment Len: 29]
    Sequence number: 556    (relative sequence number)
    [Next sequence number: 585    (relative sequence number)]
    Acknowledgment number: 713    (relative ack number)
    Header Length: 32 bytes
    .... 0000 0001 1000 = Flags: 0x018 (PSH, ACK)
    Window size value: 480
    [Calculated window size: 15360]
    [Window size scaling factor: 32]
    Checksum: 0x0214 [validation disabled]
    Urgent pointer: 0
    Options: (12 bytes), No-Operation (NOP), No-Operation (NOP), Timestamps
        No-Operation (NOP)
        No-Operation (NOP)
        Timestamps: TSval 23424858, TSecr 180776101
            Kind: Time Stamp Option (8)
            Length: 10
            Timestamp value: 23424858
            Timestamp echo reply: 180776101
    [SEQ/ACK analysis]
WebSocket
    1... .... = Fin: True
    .000 .... = Reserved: 0x00
    .... 0001 = Opcode: Text (1)
    0... .... = Mask: False
    .001 1011 = Payload length: 27
    Payload
        Text: 42["update",[0,0,0,[],0.5]]

Frame 455: 95 bytes on wire (760 bits), 95 bytes captured (760 bits) on interface 0
Ethernet II, Src: 64:66:b3:9e:39:08 (64:66:b3:9e:39:08), Dst: d4:be:d9:74:bf:b6 (d4:be:d9:74:bf:b6)
Internet Protocol Version 4, Src: 104.155.6.9 (104.155.6.9), Dst: 192.168.0.51 (192.168.0.51)
Transmission Control Protocol, Src Port: 8001 (8001), Dst Port: 38173 (38173), Seq: 585, Ack: 713, Len: 29
    Source Port: 8001 (8001)
    Destination Port: 38173 (38173)
    [Stream index: 40]
    [TCP Segment Len: 29]
    Sequence number: 585    (relative sequence number)
    [Next sequence number: 614    (relative sequence number)]
    Acknowledgment number: 713    (relative ack number)
    Header Length: 32 bytes
    .... 0000 0001 1000 = Flags: 0x018 (PSH, ACK)
    Window size value: 480
    [Calculated window size: 15360]
    [Window size scaling factor: 32]
    Checksum: 0x01eb [validation disabled]
    Urgent pointer: 0
    Options: (12 bytes), No-Operation (NOP), No-Operation (NOP), Timestamps
        No-Operation (NOP)
        No-Operation (NOP)
        Timestamps: TSval 23424870, TSecr 180776101
            Kind: Time Stamp Option (8)
            Length: 10
            Timestamp value: 23424870
            Timestamp echo reply: 180776101
    [SEQ/ACK analysis]
WebSocket
    1... .... = Fin: True
    .000 .... = Reserved: 0x00
    .... 0001 = Opcode: Text (1)
    0... .... = Mask: False
    .001 1011 = Payload length: 27
    Payload
        Text: 42["update",[0,0,0,[],0.5]]

Frame 458: 95 bytes on wire (760 bits), 95 bytes captured (760 bits) on interface 0
Ethernet II, Src: 64:66:b3:9e:39:08 (64:66:b3:9e:39:08), Dst: d4:be:d9:74:bf:b6 (d4:be:d9:74:bf:b6)
Internet Protocol Version 4, Src: 104.155.6.9 (104.155.6.9), Dst: 192.168.0.51 (192.168.0.51)
Transmission Control Protocol, Src Port: 8001 (8001), Dst Port: 38173 (38173), Seq: 614, Ack: 713, Len: 29
    Source Port: 8001 (8001)
    Destination Port: 38173 (38173)
    [Stream index: 40]
    [TCP Segment Len: 29]
    Sequence number: 614    (relative sequence number)
    [Next sequence number: 643    (relative sequence number)]
    Acknowledgment number: 713    (relative ack number)
    Header Length: 32 bytes
    .... 0000 0001 1000 = Flags: 0x018 (PSH, ACK)
    Window size value: 480
    [Calculated window size: 15360]
    [Window size scaling factor: 32]
    Checksum: 0x01a7 [validation disabled]
    Urgent pointer: 0
    Options: (12 bytes), No-Operation (NOP), No-Operation (NOP), Timestamps
        No-Operation (NOP)
        No-Operation (NOP)
        Timestamps: TSval 23424881, TSecr 180776129
            Kind: Time Stamp Option (8)
            Length: 10
            Timestamp value: 23424881
            Timestamp echo reply: 180776129
    [SEQ/ACK analysis]
WebSocket
    1... .... = Fin: True
    .000 .... = Reserved: 0x00
    .... 0001 = Opcode: Text (1)
    0... .... = Mask: False
    .001 1011 = Payload length: 27
    Payload
        Text: 42["update",[0,0,0,[],0.5]]

Frame 460: 95 bytes on wire (760 bits), 95 bytes captured (760 bits) on interface 0
Ethernet II, Src: 64:66:b3:9e:39:08 (64:66:b3:9e:39:08), Dst: d4:be:d9:74:bf:b6 (d4:be:d9:74:bf:b6)
Internet Protocol Version 4, Src: 104.155.6.9 (104.155.6.9), Dst: 192.168.0.51 (192.168.0.51)
Transmission Control Protocol, Src Port: 8001 (8001), Dst Port: 38173 (38173), Seq: 643, Ack: 713, Len: 29
    Source Port: 8001 (8001)
    Destination Port: 38173 (38173)
    [Stream index: 40]
    [TCP Segment Len: 29]
    Sequence number: 643    (relative sequence number)
    [Next sequence number: 672    (relative sequence number)]
    Acknowledgment number: 713    (relative ack number)
    Header Length: 32 bytes
    .... 0000 0001 1000 = Flags: 0x018 (PSH, ACK)
    Window size value: 480
    [Calculated window size: 15360]
    [Window size scaling factor: 32]
    Checksum: 0x0171 [validation disabled]
    Urgent pointer: 0
    Options: (12 bytes), No-Operation (NOP), No-Operation (NOP), Timestamps
        No-Operation (NOP)
        No-Operation (NOP)
        Timestamps: TSval 23424893, TSecr 180776142
            Kind: Time Stamp Option (8)
            Length: 10
            Timestamp value: 23424893
            Timestamp echo reply: 180776142
    [SEQ/ACK analysis]
WebSocket
    1... .... = Fin: True
    .000 .... = Reserved: 0x00
    .... 0001 = Opcode: Text (1)
    0... .... = Mask: False
    .001 1011 = Payload length: 27
    Payload
        Text: 42["update",[0,0,0,[],0.5]]

Frame 462: 95 bytes on wire (760 bits), 95 bytes captured (760 bits) on interface 0
Ethernet II, Src: 64:66:b3:9e:39:08 (64:66:b3:9e:39:08), Dst: d4:be:d9:74:bf:b6 (d4:be:d9:74:bf:b6)
Internet Protocol Version 4, Src: 104.155.6.9 (104.155.6.9), Dst: 192.168.0.51 (192.168.0.51)
Transmission Control Protocol, Src Port: 8001 (8001), Dst Port: 38173 (38173), Seq: 672, Ack: 713, Len: 29
    Source Port: 8001 (8001)
    Destination Port: 38173 (38173)
    [Stream index: 40]
    [TCP Segment Len: 29]
    Sequence number: 672    (relative sequence number)
    [Next sequence number: 701    (relative sequence number)]
    Acknowledgment number: 713    (relative ack number)
    Header Length: 32 bytes
    .... 0000 0001 1000 = Flags: 0x018 (PSH, ACK)
    Window size value: 480
    [Calculated window size: 15360]
    [Window size scaling factor: 32]
    Checksum: 0x013b [validation disabled]
    Urgent pointer: 0
    Options: (12 bytes), No-Operation (NOP), No-Operation (NOP), Timestamps
        No-Operation (NOP)
        No-Operation (NOP)
        Timestamps: TSval 23424904, TSecr 180776156
            Kind: Time Stamp Option (8)
            Length: 10
            Timestamp value: 23424904
            Timestamp echo reply: 180776156
    [SEQ/ACK analysis]
WebSocket
    1... .... = Fin: True
    .000 .... = Reserved: 0x00
    .... 0001 = Opcode: Text (1)
    0... .... = Mask: False
    .001 1011 = Payload length: 27
    Payload
        Text: 42["update",[0,0,0,[],0.5]]

Frame 465: 95 bytes on wire (760 bits), 95 bytes captured (760 bits) on interface 0
Ethernet II, Src: 64:66:b3:9e:39:08 (64:66:b3:9e:39:08), Dst: d4:be:d9:74:bf:b6 (d4:be:d9:74:bf:b6)
Internet Protocol Version 4, Src: 104.155.6.9 (104.155.6.9), Dst: 192.168.0.51 (192.168.0.51)
Transmission Control Protocol, Src Port: 8001 (8001), Dst Port: 38173 (38173), Seq: 701, Ack: 713, Len: 29
    Source Port: 8001 (8001)
    Destination Port: 38173 (38173)
    [Stream index: 40]
    [TCP Segment Len: 29]
    Sequence number: 701    (relative sequence number)
    [Next sequence number: 730    (relative sequence number)]
    Acknowledgment number: 713    (relative ack number)
    Header Length: 32 bytes
    .... 0000 0001 1000 = Flags: 0x018 (PSH, ACK)
    Window size value: 480
    [Calculated window size: 15360]
    [Window size scaling factor: 32]
    Checksum: 0x0106 [validation disabled]
    Urgent pointer: 0
    Options: (12 bytes), No-Operation (NOP), No-Operation (NOP), Timestamps
        No-Operation (NOP)
        No-Operation (NOP)
        Timestamps: TSval 23424915, TSecr 180776169
            Kind: Time Stamp Option (8)
            Length: 10
            Timestamp value: 23424915
            Timestamp echo reply: 180776169
    [SEQ/ACK analysis]
WebSocket
    1... .... = Fin: True
    .000 .... = Reserved: 0x00
    .... 0001 = Opcode: Text (1)
    0... .... = Mask: False
    .001 1011 = Payload length: 27
    Payload
        Text: 42["update",[0,0,0,[],0.5]]

Frame 467: 95 bytes on wire (760 bits), 95 bytes captured (760 bits) on interface 0
Ethernet II, Src: 64:66:b3:9e:39:08 (64:66:b3:9e:39:08), Dst: d4:be:d9:74:bf:b6 (d4:be:d9:74:bf:b6)
Internet Protocol Version 4, Src: 104.155.6.9 (104.155.6.9), Dst: 192.168.0.51 (192.168.0.51)
Transmission Control Protocol, Src Port: 8001 (8001), Dst Port: 38173 (38173), Seq: 730, Ack: 713, Len: 29
    Source Port: 8001 (8001)
    Destination Port: 38173 (38173)
    [Stream index: 40]
    [TCP Segment Len: 29]
    Sequence number: 730    (relative sequence number)
    [Next sequence number: 759    (relative sequence number)]
    Acknowledgment number: 713    (relative ack number)
    Header Length: 32 bytes
    .... 0000 0001 1000 = Flags: 0x018 (PSH, ACK)
    Window size value: 480
    [Calculated window size: 15360]
    [Window size scaling factor: 32]
    Checksum: 0x00cf [validation disabled]
    Urgent pointer: 0
    Options: (12 bytes), No-Operation (NOP), No-Operation (NOP), Timestamps
        No-Operation (NOP)
        No-Operation (NOP)
        Timestamps: TSval 23424927, TSecr 180776183
            Kind: Time Stamp Option (8)
            Length: 10
            Timestamp value: 23424927
            Timestamp echo reply: 180776183
    [SEQ/ACK analysis]
WebSocket
    1... .... = Fin: True
    .000 .... = Reserved: 0x00
    .... 0001 = Opcode: Text (1)
    0... .... = Mask: False
    .001 1011 = Payload length: 27
    Payload
        Text: 42["update",[0,0,0,[],0.5]]

Frame 469: 95 bytes on wire (760 bits), 95 bytes captured (760 bits) on interface 0
Ethernet II, Src: 64:66:b3:9e:39:08 (64:66:b3:9e:39:08), Dst: d4:be:d9:74:bf:b6 (d4:be:d9:74:bf:b6)
Internet Protocol Version 4, Src: 104.155.6.9 (104.155.6.9), Dst: 192.168.0.51 (192.168.0.51)
Transmission Control Protocol, Src Port: 8001 (8001), Dst Port: 38173 (38173), Seq: 759, Ack: 713, Len: 29
    Source Port: 8001 (8001)
    Destination Port: 38173 (38173)
    [Stream index: 40]
    [TCP Segment Len: 29]
    Sequence number: 759    (relative sequence number)
    [Next sequence number: 788    (relative sequence number)]
    Acknowledgment number: 713    (relative ack number)
    Header Length: 32 bytes
    .... 0000 0001 1000 = Flags: 0x018 (PSH, ACK)
    Window size value: 480
    [Calculated window size: 15360]
    [Window size scaling factor: 32]
    Checksum: 0x0099 [validation disabled]
    Urgent pointer: 0
    Options: (12 bytes), No-Operation (NOP), No-Operation (NOP), Timestamps
        No-Operation (NOP)
        No-Operation (NOP)
        Timestamps: TSval 23424938, TSecr 180776197
            Kind: Time Stamp Option (8)
            Length: 10
            Timestamp value: 23424938
            Timestamp echo reply: 180776197
    [SEQ/ACK analysis]
WebSocket
    1... .... = Fin: True
    .000 .... = Reserved: 0x00
    .... 0001 = Opcode: Text (1)
